{
  "$schema": "https://json-schema.org/draft/2020-12/schema",
  "title": "metadata_addon_primary fixture",
  "type": "object",
  "required": [
    "contract_version",
    "suite",
    "case_id",
    "now_ms",
    "input",
    "expected"
  ],
  "properties": {
    "contract_version": {
      "type": "integer",
      "minimum": 1
    },
    "suite": {
      "const": "metadata_addon_primary"
    },
    "case_id": {
      "type": "string",
      "minLength": 1
    },
    "now_ms": {
      "type": "integer",
      "minimum": 0
    },
    "input": {
      "type": "object",
      "required": [
        "addon_results"
      ],
      "properties": {
        "addon_results": {
          "type": "array",
          "minItems": 1,
          "items": {
            "type": "object",
            "required": [
              "addon_id",
              "media_id",
              "title"
            ],
            "properties": {
              "addon_id": {
                "type": "string",
                "minLength": 1
              },
              "media_id": {
                "type": "string",
                "minLength": 1
              },
              "title": {
                "type": "string",
                "minLength": 1
              }
            },
            "additionalProperties": true
          }
        }
      },
      "additionalProperties": true
    },
    "expected": {
      "type": "object",
      "required": [
        "primary_id",
        "title",
        "sources"
      ],
      "properties": {
        "primary_id": {
          "type": "string",
          "minLength": 1
        },
        "title": {
          "type": "string",
          "minLength": 1
        },
        "sources": {
          "type": "array",
          "items": {
            "type": "string",
            "minLength": 1
          }
        }
      },
      "additionalProperties": true
    }
  },
  "additionalProperties": false
}
