{
  "contract_version": 1,
  "suite": "metadata_addon_primary",
  "case_id": "preferred_addon_wins_even_if_not_cinemeta",
  "now_ms": 1739923200000,
  "input": {
    "preferred_addon_id": "meta.community",
    "addon_results": [
      {
        "addon_id": "meta.community",
        "media_id": "tt0944947",
        "title": "Game of Thrones (Community)"
      },
      {
        "addon_id": "com.linvo.cinemeta",
        "media_id": "tt0944947",
        "title": "Game of Thrones"
      },
      {
        "addon_id": "z.archive",
        "media_id": "tt0944947",
        "title": "GoT"
      }
    ]
  },
  "expected": {
    "primary_id": "tt0944947",
    "title": "Game of Thrones (Community)",
    "sources": [
      "meta.community",
      "com.linvo.cinemeta",
      "z.archive"
    ]
  }
}
