{
  "contract_version": 2,
  "suite": "metadata_addon_primary",
  "case_id": "no_preferred_addon_prefers_source_order",
  "now_ms": 1739923200000,
  "input": {
    "addon_results": [
      {
        "addon_id": "meta.community",
        "media_id": "tt0944947",
        "title": "Game of Thrones (Community)"
      },
      {
        "addon_id": "com.linvo.cinemeta",
        "media_id": "tt0944947",
        "title": "Game of Thrones"
      }
    ]
  },
  "expected": {
    "primary_id": "tt0944947",
    "title": "Game of Thrones (Community)",
    "sources": [
      "meta.community",
      "com.linvo.cinemeta"
    ]
  }
}
